<?xml version="1.0" encoding="UTF-8"?>

<!DOCTYPE hechos_historicos SYSTEM "Ejercicio1DTD.dtd">

<hechos_historicos>
	<hecho descripcion = "descripcion1">
		<fecha>
			<dia>12</dia>
			<mes>8</mes>
			<año>1981</año>
		</fecha>
	</hecho>
	<hecho descripcion = "descripcion2">
		<fecha>
			<dia>4</dia>
			<mes>9</mes>
			<año>1998</año>
		</fecha>
	</hecho>
	<hecho descripcion = "descripcion3">
		<fecha>
			<dia>4</dia>
			<mes>2</mes>
			<año>2004</año>
		</fecha>
	</hecho>
</hechos_historicos>